{
  "id": "evt-20260912T185701Z-local-v01-stage10-completed",
  "at": "2026-09-12T18:57:01Z",
  "type": "milestone_status_changed",
  "project_id": "project-item-daed6c",
  "milestone_id": "local-v01-stage10-packaging-clean-machine",
  "status": "completed",
  "summary": "Completed Local v0.1 Stage 10 — Packaging + Clean Machine Acceptance; NextPlan Local v0.1 Windows Beta passed release acceptance.",
  "source": {
    "kind": "chatgpt",
    "via": "stage5-local-v01-stage9-10-release-closure",
    "evidence": {
      "release_branch_head": "7e678f05845c4d156b8c57f61605f5211f2716f3",
      "release_acceptance_run": "34711899416",
      "release_job": "103602045544",
      "tests": "27 passed",
      "clean_machine_acceptance": "CLEAN_MACHINE_ACCEPTANCE_PASS",
      "installed_executable": "C:\\Users\\runneradmin\\AppData\\Local\\NextPlan\\nextplan-local-desktop.exe",
      "runtime": "nextplan-local-core-v4",
      "schema_version": 3,
      "artifact_id": "10303149785",
      "artifact_digest": "sha256:204ca8d7d794bf0b6875b4acdca98a0f2d171c5628dd74fcda9cd49112adf35e",
      "merge_commit": "11fd35592675b881b1a2423e112ab2d2b6f11bd8"
    }
  }
}
