{
  "type": "agent_action_recorded",
  "project_id": "project-item-daed6c",
  "agent_action": {
    "receipt_version": "agent-action-1.0",
    "action_id": "act-6c2e6512-b0c2-40bf-8b95-a7260f85f167",
    "provider": "github",
    "capability": "repo.get",
    "risk_class": "read_only",
    "idempotency_key": "stage3-read-34698733549-1",
    "status": "verified",
    "provider_result_id": "1364088011",
    "verified": true,
    "rollback_supported": false,
    "summary": "Provider action executed and verified.",
    "at": "2026-09-12T14:15:32Z",
    "project_id": "project-item-daed6c",
    "verification": {
      "verified": true,
      "evidence": {
        "full_name": "changxinjiresearch/LifeOS"
      }
    },
    "provider_result": {
      "provider_result_id": "1364088011",
      "full_name": "changxinjiresearch/LifeOS",
      "default_branch": "main",
      "private": true,
      "updated_at": "2026-09-12T14:15:31Z"
    },
    "id": "act-6c2e6512-b0c2-40bf-8b95-a7260f85f167"
  },
  "summary": "Agent action github:repo.get -> verified",
  "id": "evt-20260912T141532Z-agent-action-recor-14ca802d",
  "at": "2026-09-12T14:15:32Z",
  "source": {
    "kind": "chatgpt",
    "via": "nextplan-agent-stage3"
  }
}
