{
  "type": "agent_run_recorded",
  "project_id": "project-item-daed6c",
  "agent_run": {
    "id": "stage3-acceptance-34698733549-1",
    "project_id": "project-item-daed6c",
    "status": "completed",
    "verified": true,
    "signal_ids": [
      "signal-d885a260906935448f3dec37"
    ],
    "action_ids": [
      "act-6c2e6512-b0c2-40bf-8b95-a7260f85f167",
      "act-6346ef0d-8e2c-4385-b535-6996d5dd7177",
      "rollback-act-6346ef0d-8e2c-4385-b535-6996d5dd7177"
    ],
    "reconciliation_ids": [
      "reconcile-b6839711-8e53-4e23-adcf-a34ec9a81295"
    ],
    "summary": "Stage III server_v11 acceptance run completed",
    "at": "2026-09-12T14:15:42Z"
  },
  "summary": "Stage III server_v11 acceptance run completed",
  "id": "evt-20260912T141542Z-agent-run-recorded-2e7fcf20",
  "at": "2026-09-12T14:15:42Z",
  "source": {
    "kind": "chatgpt",
    "via": "nextplan-agent-stage3"
  }
}
