{
  "type": "calendar_event_upserted",
  "project_id": "calendar",
  "calendar_event": {
    "id": "calendar-meeting-2026-09-16-1630",
    "title": "与导师 Meeting",
    "date": "2026-09-16",
    "kind": "event",
    "time": "16:30",
    "timezone": "Australia/Adelaide",
    "category": "课程"
  },
  "summary": "Calendar: 与导师 Meeting on 2026-09-16 16:30",
  "id": "evt-20260915T135223Z-calendar-event-ups-c9e60532",
  "at": "2026-09-15T13:52:23Z",
  "source": {
    "kind": "chatgpt",
    "via": "nextplan-phase-b"
  }
}
