{
  "id": "evt-20260912T172500Z-local-v01-stage4-completed",
  "at": "2026-09-12T17:25:00Z",
  "type": "milestone_status_changed",
  "project_id": "project-item-daed6c",
  "milestone_id": "local-v01-stage4-chatgpt-local-bridge",
  "status": "completed",
  "auto_advance": false,
  "summary": "Completed Local v0.1 Stage 4 — ChatGPT ↔ NextPlan Local Bridge",
  "source": {
    "kind": "chatgpt",
    "via": "stage5-local-v01-development",
    "evidence": "PR #3 merged; branch and main Stage 4-5 acceptance passed"
  }
}
