{
  "id": "evt-20260912T151203Z-stage4-close-23",
  "at": "2026-09-12T15:12:03Z",
  "project_id": "project-item-daed6c",
  "type": "milestone_status_changed",
  "summary": "Stage IV acceptance passed: Conversation Acceptance Tests completed.",
  "source": {"kind": "chatgpt", "via": "nextplan-stage4-final-acceptance"},
  "milestone_id": "conversation-acceptance-tests",
  "status": "completed"
}
