{
  "type": "external_signal_recorded",
  "project_id": "project-item-daed6c",
  "external_signal": {
    "id": "signal-d885a260906935448f3dec37",
    "provider": "github",
    "event_type": "stage3_acceptance_probe",
    "provider_event_id": "github-actions:34698733549-1",
    "verified_source": true,
    "received_at": "2026-09-12T14:15:30Z",
    "project_id": "project-item-daed6c",
    "payload": {
      "repository": "changxinjiresearch/LifeOS",
      "workflow": "NextPlan Stage III contract tests",
      "run_id": "34698733549",
      "attempt": "1",
      "purpose": "server_v11 canonical production acceptance evidence"
    },
    "status": "observed"
  },
  "summary": "External signal: github stage3_acceptance_probe",
  "id": "evt-20260912T141530Z-external-signal-re-6095761d",
  "at": "2026-09-12T14:15:30Z",
  "source": {
    "kind": "chatgpt",
    "via": "nextplan-agent-stage3"
  }
}
