{
  "id": "evt-20261008T145551Z-project-completed-presentation",
  "at": "2026-10-08T14:55:51Z",
  "type": "project_status_changed",
  "project_id": "flinders-presentation",
  "status": "completed",
  "next_action": "项目已完成",
  "summary": "Completed project: Research Proposal / Presentation",
  "source": {
    "kind": "chatgpt",
    "via": "explicit-user-command",
    "command_time": "2026-10-08T14:55:51Z"
  }
}
