{
  "id": "evt-20260912T175900Z-local-v01-stage6-completed",
  "at": "2026-09-12T17:59:00Z",
  "type": "milestone_status_changed",
  "project_id": "project-item-daed6c",
  "milestone_id": "local-v01-stage6-desktop-app",
  "status": "completed",
  "auto_advance": false,
  "summary": "Completed Local v0.1 Stage 6 — NextPlan Desktop App",
  "source": {
    "kind": "chatgpt",
    "via": "stage5-local-v01-stage6-8-release-closure",
    "evidence": "Tauri desktop shell, Local Core process management, desktop views, Rust cargo check and mainline release gates accepted"
  }
}
